{
  "artifact_role": "illustrative-fixture",
  "encoding": "UTF-8",
  "format_version": "1",
  "id": "CONFIG-EXAMPLE",
  "instance_id": "alm.synthetic.example",
  "kind": "config",
  "line_ending": "LF",
  "primary_byte_budgets": {
    "GLOBAL": 20480,
    "PROJECT-LIBRARY": 20480,
    "TASK-DESK": 20480,
    "USER": 20480
  },
  "profile": "portable-files-alpha",
  "required_extensions": [],
  "snapshot_sequence": 21
}
